{
  "admission_state": "WITHHOLD",
  "attestation_id": "slang_claims_attestation_sha256:cfd7941ab456c78042315480b8ce9a29924b8cddb20c0ad746cea63330bcd9b6",
  "authority_manifest_id": "slang_claims_authority_manifest_sha256:ef2f94ce9bfcc1e7bd612a2523076fe30ca9120521a11d6dd4baab6d5cf3c404",
  "canonical_input_id": "slang_claims_canonical_input_sha256:ed10cf6176188ccdee51fcdb08e32ba958ba0655572800435ec2ff94b89fbd60",
  "canonicalization_id": "SLANG-CANONICAL-JSON-1-D02",
  "claim_outcome": "NONE",
  "claim_ref": "CLAIM-ALPHA",
  "claimant_ref": "CLAIMANT-ALPHA",
  "conflicts": [],
  "context_id": "slang_claims_context_sha256:ded41d63ca3b7fb8d071a9ae8e6f9c9ba78d7ec2b812e1effaaf32c138fa0dad",
  "contract_id": "slang_claims_contract_sha256:dcc9fe86df0ded6930fe7c4116ba0f22e43220605d6a0bfd96b75c44f5f19d9a",
  "core_version": "SLANG-CORE-1-D05",
  "evaluation_id": "CLAIM-EVALUATION-001",
  "evidence_agreement_id": "slang_claims_evidence_agreement_sha256:e570ffc786fa232a420ad8cfeb4ab4c22f8c28dae468a9a6454605da266a6a3e",
  "evidence_set_id": "slang_claims_evidence_set_sha256:739a43993c0d8b72547cb78991cb03f69efb0f451b277231a60ee4a686206dfe",
  "fraud_determination_authority": "NONE",
  "identity_domain_id": "slang_claims_identity_domain_sha256:849c01acebc72403093ffa5e6878136d06a33cbb96ae2ab82827ec91e9cb999e",
  "legal_authority": "NONE",
  "loss_event_ref": "LOSS-EVENT-ALPHA",
  "missing_dependencies": [],
  "money_movement": "NONE",
  "outcome_id": "NONE",
  "payment_authority": "NONE",
  "policy_interpretation_authority": "NONE",
  "policy_ref": "POLICY-ALPHA",
  "profile_id": "SLANG-CLAIMS-PROFILE-1-D03",
  "prohibitions": [],
  "reason_codes": [
    "EVALUATION_NOT_AUTHORIZED"
  ],
  "resolution_state": "ABSTAIN",
  "result_id": "slang_claims_result_sha256:67bc4e906626739d5c5ed8b55f01a1d425e42f6f8a41b294c4be000209bf9e7b",
  "rule_profile_id": "slang_claims_rule_profile_sha256:a041dcc044c88fa7d05e3828829dda4c85a90882ee2771dfe45576a22a6af629",
  "ruleset_id": "SLANG-CLAIMS-RULESET-1-D03",
  "schema": "SLANG-CLAIMS-ATTESTATION-1",
  "settlement_authority": "NONE",
  "source_authenticity": "NOT_ESTABLISHED_BY_REFERENCE_PROFILE",
  "state": "ABSTAIN",
  "submission_id": "slang_claims_submission_sha256:ed10cf6176188ccdee51fcdb08e32ba958ba0655572800435ec2ff94b89fbd60",
  "version": "0.2.1"
}
